483,2024-04-09,2024-05-01,ENPROCESO,3,87,87,quis justo maecenas rhoncus aliquam lacus morbi quis tortor id nulla ultrices aliquet maecenas
484,2024-04-21,2024-04-29,RESUELTO,2,17,17,consequat ut nulla sed accumsan
485,2024-04-20,2024-04-28,RESUELTO,2,15,15,at velit eu est congue elementum in hac habitasse platea dictumst morbi
486,2024-04-25,2024-04-28,ENPROCESO,3,62,62,montes nascetur ridiculus mus etiam vel augue vestibulum rutrum rutrum
487,2024-04-16,2024-04-28,ABIERTO,1,85,85,lectus in quam fringilla rhoncus mauris enim leo rhoncus sed vestibulum
488,2024-04-25,2024-05-01,ENPROCESO,1,29,29,sit amet diam in magna bibendum imperdiet nullam orci pede venenatis
489,2024-04-07,2024-04-29,RESUELTO,1,37,37,ipsum dolor sit amet consectetuer adipiscing elit
490,2024-04-11,2024-04-29,RESUELTO,3,26,26,imperdiet sapien urna pretium nisl ut volutpat sapien
491,2024-04-26,2024-04-29,RESUELTO,2,60,60,magna at nunc commodo placerat praesent blandit
492,2024-04-18,2024-05-01,ENPROCESO,1,100,100,orci pede venenatis non sodales sed tincidunt eu felis fusce posuere felis sed lacus morbi
493,2024-04-20,2024-04-30,ABIERTO,1,93,93,varius integer ac leo pellentesque ultrices mattis
494,2024-04-06,2024-04-30,ABIERTO,1,77,77,in faucibus orci luctus et ultrices
495,2024-04-04,2024-04-30,ABIERTO,3,34,34,in hac habitasse platea dictumst
496,2024-04-15,2024-04-28,ABIERTO,2,23,23,id sapien in sapien iaculis congue vivamus metus arcu adipiscing molestie hendrerit at vulputate
497,2024-04-21,2024-05-01,ABIERTO,3,78,78,orci vehicula condimentum curabitur in libero
498,2024-04-13,2024-05-01,ABIERTO,1,3,3,non mi integer ac neque duis
499,2024-04-04,2024-04-29,ENPROCESO,3,41,41,nullam sit amet turpis elementum ligula vehicula consequat morbi
500,2024-04-22,2024-05-01,RESUELTO,3,80,80,at nibh in hac habitasse platea dictumst aliquam augue quam sollicitudin vitae consectetuer eget
